{
  "$schema": "./kf1-device-profile-v1.schema.json",
  "schema_version": 1,
  "profile_id": "titan2-stock-v01.00.13",
  "device_class": "titan2",
  "interaction_profile": "KEYBOARD_FIRST",
  "support_level": "N0_GSI_USERSPACE_LAB",
  "evidence": {
    "state": "PHYSICALLY_VERIFIED",
    "baseline": {
      "stock_build": "V01.00.13",
      "android_release": 16,
      "security_patch": "2025-12-05"
    },
    "source_repository": "aimindseye/unihertz-titan2",
    "source_documents": [
      "docs/TITAN2_KEYBOARD_ADAPTER_CONTRACT.md",
      "docs/TITAN2_TIER1_FINDINGS.md",
      "docs/TITAN_FAMILY_SABLEOS_RESEARCH_CHECKLIST.md",
      "docs/CAMERA_RESEARCH.md"
    ]
  },
  "displays": [
    {
      "id": "primary-square",
      "role": "PRIMARY",
      "native_width_px": 1440,
      "native_height_px": 1440,
      "refresh_hz": 60,
      "base_density_dpi": 400,
      "identity_strategy": "PRIMARY_DEFAULT_DISPLAY",
      "android_display_id_policy": "DISCOVER",
      "touch_association": "PRIMARY_TOUCH",
      "stock_can_host_tasks": true,
      "stock_security_class": "PRIMARY_TRUSTED",
      "notes": "Near-square primary display. No cutout. Rounded-corner handling remains a presentation concern."
    },
    {
      "id": "rear-subscreen",
      "role": "SECONDARY_REAR",
      "native_width_px": 410,
      "native_height_px": 502,
      "refresh_hz": 60,
      "base_density_dpi": 400,
      "identity_strategy": "DISCOVER_BY_DEVICE_PROFILE",
      "android_display_id_policy": "DISCOVER",
      "touch_association": "DYNAMIC_ASSOCIATION",
      "stock_can_host_tasks": false,
      "stock_security_class": "PRIVATE_TRUSTED_SECURE_OWN_DISPLAY_GROUP",
      "notes": "Runtime Android display ID is not stable. Stock presentation has independent brightness, rotation and touch association."
    }
  ],
  "input_surfaces": [
    {
      "id": "titan-keyboard",
      "surface_type": "PHYSICAL_KEYBOARD",
      "surface_location": "KEYBOARD_MATRIX",
      "linux_name": "TitanKey",
      "transport": "I2C 6-0058",
      "driver": "TitanKey",
      "module": "aw9523_key",
      "normalization": "STANDARD_ANDROID_KEY_EVENT",
      "capabilities": [
        "PHYSICAL_KEY_MATRIX",
        "MODIFIER_KEYS",
        "KEY_REPEAT",
        "KEYBOARD_WAKE_POLICY"
      ],
      "stock_wake_behavior": "Ordinary matrix keys including Space do not wake from stock screen-off state; DT exposes wakeup_key=57 with wake_up_enable=0.",
      "semantic_default": null,
      "ownership": "HARDWARE_REQUIRED",
      "notes": "Stock Android keylayout/keychars are TitanKey.kl and TitanKey.kcm. Scan-code quirks stay below common Sable semantics."
    },
    {
      "id": "keyboard-touch-surface",
      "surface_type": "ABSOLUTE_TOUCH_SURFACE",
      "surface_location": "KEYBOARD_MATRIX",
      "linux_name": "touchPad",
      "transport": "I2C 2-0020",
      "driver": "synaptics_dsx_pad",
      "module": "synaptics_1403_touch",
      "normalization": "RAW_ABS_MT",
      "capabilities": [
        "ABSOLUTE_TOUCH",
        "TAP",
        "SWIPE",
        "POINTER_POLICY_ELIGIBLE"
      ],
      "stock_wake_behavior": null,
      "semantic_default": null,
      "ownership": "HARDWARE_REQUIRED",
      "notes": "Stock Mouse Mode is Android Mouse Keys layered above this raw ABS_MT surface. Sable pointer/gesture semantics remain policy."
    },
    {
      "id": "func1",
      "surface_type": "PROGRAMMABLE_KEY",
      "surface_location": "DEVICE_SIDE",
      "linux_name": "mtk-pmic-keys",
      "transport": "PMIC",
      "driver": "mtk-pmic-keys",
      "module": "mtk_pmic_keys",
      "normalization": "SABLE_PROGRAMMABLE_ACTION",
      "capabilities": [
        "PROGRAMMABLE_KEYS",
        "WAKE_SOURCE"
      ],
      "scan_code": 249,
      "stock_wake_behavior": "Available while screen is off and stock policy can wake/activate the rear SubScreen.",
      "semantic_default": null,
      "ownership": "HARDWARE_REQUIRED",
      "notes": "Generic.kl maps scan 249 to FUNC1. Stock AGUI/PhoneWindowManager policy is replaceable."
    },
    {
      "id": "func2",
      "surface_type": "PROGRAMMABLE_KEY",
      "surface_location": "DEVICE_SIDE",
      "linux_name": "gpio_key-func",
      "transport": "GPIO",
      "driver": "agold_gpio_key",
      "module": "gpio_key",
      "normalization": "SABLE_PROGRAMMABLE_ACTION",
      "capabilities": [
        "PROGRAMMABLE_KEYS"
      ],
      "scan_code": 250,
      "stock_wake_behavior": "Available in the observed screen-off path without a visible display wake.",
      "semantic_default": null,
      "ownership": "HARDWARE_REQUIRED",
      "notes": "Runtime producer is gpio_key.ko. A PMIC keycode-250 capability also exists in DT but is not the observed Func2 producer."
    },
    {
      "id": "fingerprint-gesture-helper",
      "surface_type": "FINGERPRINT_GESTURE_HELPER",
      "surface_location": "FINGERPRINT_SENSOR",
      "linux_name": "ff_key",
      "transport": null,
      "driver": "focaltech_fp",
      "module": "focaltech_fp",
      "normalization": "OPTIONAL_GESTURE_ACTION",
      "capabilities": [
        "FINGERPRINT_GESTURE_KEYS"
      ],
      "stock_wake_behavior": null,
      "semantic_default": null,
      "ownership": "OPTIONAL_DEVICE_CAPABILITY",
      "notes": "Not part of the physical keyboard contract. Preserve only if Sable intentionally supports fingerprint gesture actions."
    }
  ],
  "indicators": [
    {
      "id": "keyboard-backlight",
      "indicator_type": "KEYBOARD_BACKLIGHT",
      "backend": "keypad_led.ko / MediaTek PWM",
      "sysfs_path": "/sys/devices/platform/keypad_led/keyled_brightness",
      "api_min": 0,
      "api_max": 100,
      "effective_min_nonzero": 8,
      "effective_max": 99,
      "ownership": "KERNEL_BACKEND",
      "notes": "0 disables PWM; public 1..7 clamp to effective 8; 8..99 map directly; 100 clamps to effective 99. Sable policy should mediate access rather than UI writing sysfs directly."
    }
  ],
  "vendor_compatibility": [
    {
      "id": "agui-synthetic-key-404",
      "kind": "SYNTHETIC_ANDROID_KEY",
      "stock_value": 404,
      "sable_exposure": "DO_NOT_EXPOSE_AS_COMMON_SEMANTIC",
      "producer": "android::KeyboardInputMapper::aguiSetProgrammableKey(int)",
      "consumers": [
        "android::InputDispatcher::notifyKey",
        "com.android.server.policy.PhoneWindowManager",
        "com.agui.server.functional.AguiKeyboardShortcut"
      ],
      "notes": "Vendor compatibility translation. Sable should normalize the underlying physical/gesture capability instead of standardizing key 404."
    }
  ],
  "policy_decisions": [
    {
      "id": "FUNC1_DEFAULT_ACTION",
      "state": "UNDECIDED",
      "question": "What Sable semantic action should Func1 invoke by default?",
      "decision": null
    },
    {
      "id": "FUNC2_DEFAULT_ACTION",
      "state": "UNDECIDED",
      "question": "What Sable semantic action should Func2 invoke by default?",
      "decision": null
    },
    {
      "id": "PRIMARY_DISPLAY_WAKE_KEYS",
      "state": "UNDECIDED",
      "question": "Which physical keys, if any, may wake the primary display?",
      "decision": null
    },
    {
      "id": "KEYBOARD_TOUCH_DEFAULT_MODE",
      "state": "UNDECIDED",
      "question": "Should the keyboard touch surface default to pointer, gesture, or a user-selectable hybrid mode?",
      "decision": null
    },
    {
      "id": "KEYBOARD_BACKLIGHT_POLICY",
      "state": "UNDECIDED",
      "question": "What are Sable defaults for brightness, timeout, wake-on-key and optional attention use?",
      "decision": null
    },
    {
      "id": "REAR_SUBSCREEN_PRODUCT_ROLE",
      "state": "UNDECIDED",
      "question": "Is the rear display a glance/notification surface, bounded Sable mini-surface host, selected-app surface, or general secondary task display?",
      "decision": null
    }
  ]
}
